{
  "schemaVersion": "1.0.0",
  "runId": "candidate-sensor-smoke-1",
  "status": "passed",
  "manifest": {
    "scenarioId": "sensor-smoke",
    "scenarioVersion": "1.0.0",
    "scenarioHash": "sha256:1111111111111111111111111111111111111111111111111111111111111111",
    "packHash": "sha256:2222222222222222222222222222222222222222222222222222222222222222",
    "generatorVersion": "1.2.0",
    "seed": 17,
    "variantId": "seed-17",
    "fixtureHash": "sha256:3333333333333333333333333333333333333333333333333333333333333333",
    "expectedOracleHash": "sha256:4444444444444444444444444444444444444444444444444444444444444444",
    "harness": {
      "commit": "aaaaaaaaaaaaaaaaaaaaaaaaaaaaaaaaaaaaaaaa",
      "dirty": false
    },
    "candidateProject": {
      "commit": "bbbbbbbbbbbbbbbbbbbbbbbbbbbbbbbbbbbbbbbb",
      "dirty": true
    },
    "piVersion": "0.80.6",
    "model": {
      "provider": "local",
      "id": "fictional-model",
      "contextWindow": null,
      "maximumOutputTokens": null
    },
    "thinkingLevel": "low",
    "launcherIdentity": "pi-harness-candidate-override",
    "system": "x86_64-linux",
    "timeouts": {
      "promptMs": 30000,
      "runMs": 120000
    },
    "startedAt": "2026-08-28T12:00:00Z",
    "finishedAt": "2026-08-28T12:00:04Z",
    "runLabel": "candidate"
  },
  "metrics": {
    "schemaVersion": "1.0.0",
    "reliability": {
      "passed": true,
      "processExitStatus": 0,
      "timeoutCount": 0,
      "extensionErrorCount": 0,
      "toolErrorCount": 0,
      "nonRetryableErrorCount": 0,
      "truncatedCompletionCount": 0,
      "agentSettled": true
    },
    "efficiency": {
      "wallClockMs": 4200,
      "timeToFirstToolCallMs": 500,
      "timeToFirstUsefulToolCallMs": 500,
      "agentTurns": 2,
      "totalToolCalls": 2,
      "uniqueToolCalls": 2,
      "repeatedIdenticalToolCalls": 0,
      "toolCallsBeforeUsefulAction": 0,
      "inputTokens": 1200,
      "outputTokens": 300,
      "cacheTokens": null,
      "totalTokens": 1500,
      "peakContextTokens": 1200,
      "compactionCount": 0,
      "finalResponseCharacters": 180
    },
    "toolBehavior": {
      "requiredToolsMissing": [],
      "forbiddenToolsUsed": [],
      "blockedAttempts": 0,
      "staleToolNames": [],
      "repeatedFailedCalls": 0,
      "authorityChangingCommands": [],
      "unexpectedUiRequests": 0
    },
    "workspaceBehavior": {
      "changedPaths": ["answer.md"],
      "protectedPathsChanged": [],
      "gitClean": false,
      "commitsCreated": 0,
      "graderCommandFailures": 0
    }
  },
  "grade": {
    "passed": true,
    "failures": []
  },
  "artifacts": [
    "manifest.json",
    "events.jsonl",
    "metrics.json",
    "grade.json",
    "report.md"
  ]
}
